No.     Time            Source                Destination           Protocol Length Info
      1 17:49:10.681986 10.207.175.99         176.32.98.166         TCP      76     35755→80 [SYN] Seq=0 Win=14600 Len=0 MSS=1460 SACK_PERM=1 TSval=73298 TSecr=0 WS=64

Frame 1: 76 bytes on wire (608 bits), 76 bytes captured (608 bits)
Linux cooked capture
Internet Protocol Version 4, Src: 10.207.175.99 (10.207.175.99), Dst: 176.32.98.166 (176.32.98.166)
Transmission Control Protocol, Src Port: 35755 (35755), Dst Port: 80 (80), Seq: 0, Len: 0

No.     Time            Source                Destination           Protocol Length Info
      2 17:49:10.772922 176.32.98.166         10.207.175.99         TCP      76     80→35755 [SYN, ACK] Seq=0 Ack=1 Win=14480 Len=0 MSS=1460 SACK_PERM=1 TSval=4128252773 TSecr=73298 WS=512

Frame 2: 76 bytes on wire (608 bits), 76 bytes captured (608 bits)
Linux cooked capture
Internet Protocol Version 4, Src: 176.32.98.166 (176.32.98.166), Dst: 10.207.175.99 (10.207.175.99)
Transmission Control Protocol, Src Port: 80 (80), Dst Port: 35755 (35755), Seq: 0, Ack: 1, Len: 0

No.     Time            Source                Destination           Protocol Length Info
      3 17:49:10.773124 10.207.175.99         176.32.98.166         TCP      68     35755→80 [ACK] Seq=1 Ack=1 Win=14656 Len=0 TSval=73307 TSecr=4128252773

Frame 3: 68 bytes on wire (544 bits), 68 bytes captured (544 bits)
Linux cooked capture
Internet Protocol Version 4, Src: 10.207.175.99 (10.207.175.99), Dst: 176.32.98.166 (176.32.98.166)
Transmission Control Protocol, Src Port: 35755 (35755), Dst Port: 80 (80), Seq: 1, Ack: 1, Len: 0

No.     Time            Source                Destination           Protocol Length Info
      4 17:49:10.774329 10.207.175.99         176.32.98.166         HTTP     314    GET / HTTP/1.1 

Frame 4: 314 bytes on wire (2512 bits), 314 bytes captured (2512 bits)
Linux cooked capture
Internet Protocol Version 4, Src: 10.207.175.99 (10.207.175.99), Dst: 176.32.98.166 (176.32.98.166)
Transmission Control Protocol, Src Port: 35755 (35755), Dst Port: 80 (80), Seq: 1, Ack: 1, Len: 246
Hypertext Transfer Protocol
    GET / HTTP/1.1\r\n
    Accept-Encoding: gzip\r\n
    Host: www.amazon.com\r\n
    Connection: Keep-Alive\r\n
    User-Agent: Mozilla/5.0 (Linux; Android 4.4.2; SM-G900F Build/KOT49H) AppleWebKit/537.36 (KHTML, like Gecko) Version/4.0 Chrome/30.0.0.0 Mobile Safari/537.36\r\n
    \r\n
    [Full request URI: http://www.amazon.com/]
    [HTTP request 1/1]
    [Response in frame: 135]

No.     Time            Source                Destination           Protocol Length Info
      5 17:49:10.806451 176.32.98.166         10.207.175.99         TCP      68     80→35755 [ACK] Seq=1 Ack=247 Win=15872 Len=0 TSval=4128252806 TSecr=73307

Frame 5: 68 bytes on wire (544 bits), 68 bytes captured (544 bits)
Linux cooked capture
Internet Protocol Version 4, Src: 176.32.98.166 (176.32.98.166), Dst: 10.207.175.99 (10.207.175.99)
Transmission Control Protocol, Src Port: 80 (80), Dst Port: 35755 (35755), Seq: 1, Ack: 247, Len: 0

No.     Time            Source                Destination           Protocol Length Info
      6 17:49:11.091355 176.32.98.166         10.207.175.99         TCP      1516   [TCP segment of a reassembled PDU]

Frame 6: 1516 bytes on wire (12128 bits), 1516 bytes captured (12128 bits)
Linux cooked capture
Internet Protocol Version 4, Src: 176.32.98.166 (176.32.98.166), Dst: 10.207.175.99 (10.207.175.99)
Transmission Control Protocol, Src Port: 80 (80), Dst Port: 35755 (35755), Seq: 1, Ack: 247, Len: 1448

No.     Time            Source                Destination           Protocol Length Info
      7 17:49:11.091673 176.32.98.166         10.207.175.99         TCP      1516   [TCP segment of a reassembled PDU]

Frame 7: 1516 bytes on wire (12128 bits), 1516 bytes captured (12128 bits)
Linux cooked capture
Internet Protocol Version 4, Src: 176.32.98.166 (176.32.98.166), Dst: 10.207.175.99 (10.207.175.99)
Transmission Control Protocol, Src Port: 80 (80), Dst Port: 35755 (35755), Seq: 1449, Ack: 247, Len: 1448

No.     Time            Source                Destination           Protocol Length Info
      8 17:49:11.091813 176.32.98.166         10.207.175.99         TCP      1516   [TCP segment of a reassembled PDU]

Frame 8: 1516 bytes on wire (12128 bits), 1516 bytes captured (12128 bits)
Linux cooked capture
Internet Protocol Version 4, Src: 176.32.98.166 (176.32.98.166), Dst: 10.207.175.99 (10.207.175.99)
Transmission Control Protocol, Src Port: 80 (80), Dst Port: 35755 (35755), Seq: 2897, Ack: 247, Len: 1448

No.     Time            Source                Destination           Protocol Length Info
      9 17:49:11.091967 176.32.98.166         10.207.175.99         TCP      406    [TCP segment of a reassembled PDU]

Frame 9: 406 bytes on wire (3248 bits), 406 bytes captured (3248 bits)
Linux cooked capture
Internet Protocol Version 4, Src: 176.32.98.166 (176.32.98.166), Dst: 10.207.175.99 (10.207.175.99)
Transmission Control Protocol, Src Port: 80 (80), Dst Port: 35755 (35755), Seq: 4345, Ack: 247, Len: 338

No.     Time            Source                Destination           Protocol Length Info
     10 17:49:11.092708 176.32.98.166         10.207.175.99         TCP      1516   [TCP segment of a reassembled PDU]

Frame 10: 1516 bytes on wire (12128 bits), 1516 bytes captured (12128 bits)
Linux cooked capture
Internet Protocol Version 4, Src: 176.32.98.166 (176.32.98.166), Dst: 10.207.175.99 (10.207.175.99)
Transmission Control Protocol, Src Port: 80 (80), Dst Port: 35755 (35755), Seq: 4683, Ack: 247, Len: 1448

No.     Time            Source                Destination           Protocol Length Info
     11 17:49:11.092876 176.32.98.166         10.207.175.99         TCP      82     [TCP segment of a reassembled PDU]

Frame 11: 82 bytes on wire (656 bits), 82 bytes captured (656 bits)
Linux cooked capture
Internet Protocol Version 4, Src: 176.32.98.166 (176.32.98.166), Dst: 10.207.175.99 (10.207.175.99)
Transmission Control Protocol, Src Port: 80 (80), Dst Port: 35755 (35755), Seq: 6131, Ack: 247, Len: 14

No.     Time            Source                Destination           Protocol Length Info
     12 17:49:11.092972 176.32.98.166         10.207.175.99         TCP      1516   [TCP segment of a reassembled PDU]

Frame 12: 1516 bytes on wire (12128 bits), 1516 bytes captured (12128 bits)
Linux cooked capture
Internet Protocol Version 4, Src: 176.32.98.166 (176.32.98.166), Dst: 10.207.175.99 (10.207.175.99)
Transmission Control Protocol, Src Port: 80 (80), Dst Port: 35755 (35755), Seq: 6145, Ack: 247, Len: 1448

No.     Time            Source                Destination           Protocol Length Info
     13 17:49:11.093103 176.32.98.166         10.207.175.99         TCP      691    [TCP segment of a reassembled PDU]

Frame 13: 691 bytes on wire (5528 bits), 691 bytes captured (5528 bits)
Linux cooked capture
Internet Protocol Version 4, Src: 176.32.98.166 (176.32.98.166), Dst: 10.207.175.99 (10.207.175.99)
Transmission Control Protocol, Src Port: 80 (80), Dst Port: 35755 (35755), Seq: 7593, Ack: 247, Len: 623

No.     Time            Source                Destination           Protocol Length Info
     14 17:49:11.094179 10.207.175.99         176.32.98.166         TCP      68     35755→80 [ACK] Seq=247 Ack=1449 Win=17536 Len=0 TSval=73339 TSecr=4128253093

Frame 14: 68 bytes on wire (544 bits), 68 bytes captured (544 bits)
Linux cooked capture
Internet Protocol Version 4, Src: 10.207.175.99 (10.207.175.99), Dst: 176.32.98.166 (176.32.98.166)
Transmission Control Protocol, Src Port: 35755 (35755), Dst Port: 80 (80), Seq: 247, Ack: 1449, Len: 0

No.     Time            Source                Destination           Protocol Length Info
     15 17:49:11.096159 10.207.175.99         176.32.98.166         TCP      68     35755→80 [ACK] Seq=247 Ack=2897 Win=20416 Len=0 TSval=73339 TSecr=4128253093

Frame 15: 68 bytes on wire (544 bits), 68 bytes captured (544 bits)
Linux cooked capture
Internet Protocol Version 4, Src: 10.207.175.99 (10.207.175.99), Dst: 176.32.98.166 (176.32.98.166)
Transmission Control Protocol, Src Port: 35755 (35755), Dst Port: 80 (80), Seq: 247, Ack: 2897, Len: 0

No.     Time            Source                Destination           Protocol Length Info
     16 17:49:11.096897 10.207.175.99         176.32.98.166         TCP      68     35755→80 [ACK] Seq=247 Ack=4345 Win=23296 Len=0 TSval=73339 TSecr=4128253093

Frame 16: 68 bytes on wire (544 bits), 68 bytes captured (544 bits)
Linux cooked capture
Internet Protocol Version 4, Src: 10.207.175.99 (10.207.175.99), Dst: 176.32.98.166 (176.32.98.166)
Transmission Control Protocol, Src Port: 35755 (35755), Dst Port: 80 (80), Seq: 247, Ack: 4345, Len: 0

No.     Time            Source                Destination           Protocol Length Info
     17 17:49:11.097437 10.207.175.99         176.32.98.166         TCP      68     35755→80 [ACK] Seq=247 Ack=4683 Win=26240 Len=0 TSval=73339 TSecr=4128253093

Frame 17: 68 bytes on wire (544 bits), 68 bytes captured (544 bits)
Linux cooked capture
Internet Protocol Version 4, Src: 10.207.175.99 (10.207.175.99), Dst: 176.32.98.166 (176.32.98.166)
Transmission Control Protocol, Src Port: 35755 (35755), Dst Port: 80 (80), Seq: 247, Ack: 4683, Len: 0

No.     Time            Source                Destination           Protocol Length Info
     18 17:49:11.097951 10.207.175.99         176.32.98.166         TCP      68     35755→80 [ACK] Seq=247 Ack=6131 Win=29120 Len=0 TSval=73339 TSecr=4128253093

Frame 18: 68 bytes on wire (544 bits), 68 bytes captured (544 bits)
Linux cooked capture
Internet Protocol Version 4, Src: 10.207.175.99 (10.207.175.99), Dst: 176.32.98.166 (176.32.98.166)
Transmission Control Protocol, Src Port: 35755 (35755), Dst Port: 80 (80), Seq: 247, Ack: 6131, Len: 0

No.     Time            Source                Destination           Protocol Length Info
     19 17:49:11.098794 10.207.175.99         176.32.98.166         TCP      68     35755→80 [ACK] Seq=247 Ack=6145 Win=29120 Len=0 TSval=73340 TSecr=4128253093

Frame 19: 68 bytes on wire (544 bits), 68 bytes captured (544 bits)
Linux cooked capture
Internet Protocol Version 4, Src: 10.207.175.99 (10.207.175.99), Dst: 176.32.98.166 (176.32.98.166)
Transmission Control Protocol, Src Port: 35755 (35755), Dst Port: 80 (80), Seq: 247, Ack: 6145, Len: 0

No.     Time            Source                Destination           Protocol Length Info
     20 17:49:11.099328 10.207.175.99         176.32.98.166         TCP      68     35755→80 [ACK] Seq=247 Ack=7593 Win=32000 Len=0 TSval=73340 TSecr=4128253093

Frame 20: 68 bytes on wire (544 bits), 68 bytes captured (544 bits)
Linux cooked capture
Internet Protocol Version 4, Src: 10.207.175.99 (10.207.175.99), Dst: 176.32.98.166 (176.32.98.166)
Transmission Control Protocol, Src Port: 35755 (35755), Dst Port: 80 (80), Seq: 247, Ack: 7593, Len: 0

No.     Time            Source                Destination           Protocol Length Info
     21 17:49:11.099619 10.207.175.99         176.32.98.166         TCP      68     35755→80 [ACK] Seq=247 Ack=8216 Win=34880 Len=0 TSval=73340 TSecr=4128253093

Frame 21: 68 bytes on wire (544 bits), 68 bytes captured (544 bits)
Linux cooked capture
Internet Protocol Version 4, Src: 10.207.175.99 (10.207.175.99), Dst: 176.32.98.166 (176.32.98.166)
Transmission Control Protocol, Src Port: 35755 (35755), Dst Port: 80 (80), Seq: 247, Ack: 8216, Len: 0

No.     Time            Source                Destination           Protocol Length Info
     22 17:49:11.107949 176.32.98.166         10.207.175.99         TCP      1186   [TCP segment of a reassembled PDU]

Frame 22: 1186 bytes on wire (9488 bits), 1186 bytes captured (9488 bits)
Linux cooked capture
Internet Protocol Version 4, Src: 176.32.98.166 (176.32.98.166), Dst: 10.207.175.99 (10.207.175.99)
Transmission Control Protocol, Src Port: 80 (80), Dst Port: 35755 (35755), Seq: 8216, Ack: 247, Len: 1118

No.     Time            Source                Destination           Protocol Length Info
     23 17:49:11.108259 10.207.175.99         176.32.98.166         TCP      68     35755→80 [ACK] Seq=247 Ack=9334 Win=37824 Len=0 TSval=73341 TSecr=4128253109

Frame 23: 68 bytes on wire (544 bits), 68 bytes captured (544 bits)
Linux cooked capture
Internet Protocol Version 4, Src: 10.207.175.99 (10.207.175.99), Dst: 176.32.98.166 (176.32.98.166)
Transmission Control Protocol, Src Port: 35755 (35755), Dst Port: 80 (80), Seq: 247, Ack: 9334, Len: 0

No.     Time            Source                Destination           Protocol Length Info
     24 17:49:11.130845 176.32.98.166         10.207.175.99         TCP      1516   [TCP segment of a reassembled PDU]

Frame 24: 1516 bytes on wire (12128 bits), 1516 bytes captured (12128 bits)
Linux cooked capture
Internet Protocol Version 4, Src: 176.32.98.166 (176.32.98.166), Dst: 10.207.175.99 (10.207.175.99)
Transmission Control Protocol, Src Port: 80 (80), Dst Port: 35755 (35755), Seq: 9334, Ack: 247, Len: 1448

No.     Time            Source                Destination           Protocol Length Info
     25 17:49:11.131071 176.32.98.166         10.207.175.99         TCP      149    [TCP segment of a reassembled PDU]

Frame 25: 149 bytes on wire (1192 bits), 149 bytes captured (1192 bits)
Linux cooked capture
Internet Protocol Version 4, Src: 176.32.98.166 (176.32.98.166), Dst: 10.207.175.99 (10.207.175.99)
Transmission Control Protocol, Src Port: 80 (80), Dst Port: 35755 (35755), Seq: 10782, Ack: 247, Len: 81

No.     Time            Source                Destination           Protocol Length Info
     26 17:49:11.131115 176.32.98.166         10.207.175.99         TCP      1336   [TCP segment of a reassembled PDU]

Frame 26: 1336 bytes on wire (10688 bits), 1336 bytes captured (10688 bits)
Linux cooked capture
Internet Protocol Version 4, Src: 176.32.98.166 (176.32.98.166), Dst: 10.207.175.99 (10.207.175.99)
Transmission Control Protocol, Src Port: 80 (80), Dst Port: 35755 (35755), Seq: 10863, Ack: 247, Len: 1268

No.     Time            Source                Destination           Protocol Length Info
     27 17:49:11.131158 176.32.98.166         10.207.175.99         TCP      1405   [TCP segment of a reassembled PDU]

Frame 27: 1405 bytes on wire (11240 bits), 1405 bytes captured (11240 bits)
Linux cooked capture
Internet Protocol Version 4, Src: 176.32.98.166 (176.32.98.166), Dst: 10.207.175.99 (10.207.175.99)
Transmission Control Protocol, Src Port: 80 (80), Dst Port: 35755 (35755), Seq: 12131, Ack: 247, Len: 1337

No.     Time            Source                Destination           Protocol Length Info
     28 17:49:11.131765 10.207.175.99         176.32.98.166         TCP      68     35755→80 [ACK] Seq=247 Ack=10782 Win=40704 Len=0 TSval=73343 TSecr=4128253132

Frame 28: 68 bytes on wire (544 bits), 68 bytes captured (544 bits)
Linux cooked capture
Internet Protocol Version 4, Src: 10.207.175.99 (10.207.175.99), Dst: 176.32.98.166 (176.32.98.166)
Transmission Control Protocol, Src Port: 35755 (35755), Dst Port: 80 (80), Seq: 247, Ack: 10782, Len: 0

No.     Time            Source                Destination           Protocol Length Info
     29 17:49:11.132464 10.207.175.99         176.32.98.166         TCP      68     35755→80 [ACK] Seq=247 Ack=10863 Win=40704 Len=0 TSval=73343 TSecr=4128253132

Frame 29: 68 bytes on wire (544 bits), 68 bytes captured (544 bits)
Linux cooked capture
Internet Protocol Version 4, Src: 10.207.175.99 (10.207.175.99), Dst: 176.32.98.166 (176.32.98.166)
Transmission Control Protocol, Src Port: 35755 (35755), Dst Port: 80 (80), Seq: 247, Ack: 10863, Len: 0

No.     Time            Source                Destination           Protocol Length Info
     30 17:49:11.132652 10.207.175.99         176.32.98.166         TCP      68     35755→80 [ACK] Seq=247 Ack=12131 Win=43584 Len=0 TSval=73343 TSecr=4128253132

Frame 30: 68 bytes on wire (544 bits), 68 bytes captured (544 bits)
Linux cooked capture
Internet Protocol Version 4, Src: 10.207.175.99 (10.207.175.99), Dst: 176.32.98.166 (176.32.98.166)
Transmission Control Protocol, Src Port: 35755 (35755), Dst Port: 80 (80), Seq: 247, Ack: 12131, Len: 0

No.     Time            Source                Destination           Protocol Length Info
     31 17:49:11.132827 10.207.175.99         176.32.98.166         TCP      68     35755→80 [ACK] Seq=247 Ack=13468 Win=46464 Len=0 TSval=73343 TSecr=4128253133

Frame 31: 68 bytes on wire (544 bits), 68 bytes captured (544 bits)
Linux cooked capture
Internet Protocol Version 4, Src: 10.207.175.99 (10.207.175.99), Dst: 176.32.98.166 (176.32.98.166)
Transmission Control Protocol, Src Port: 35755 (35755), Dst Port: 80 (80), Seq: 247, Ack: 13468, Len: 0

No.     Time            Source                Destination           Protocol Length Info
     32 17:49:11.202865 176.32.98.166         10.207.175.99         TCP      1516   [TCP segment of a reassembled PDU]

Frame 32: 1516 bytes on wire (12128 bits), 1516 bytes captured (12128 bits)
Linux cooked capture
Internet Protocol Version 4, Src: 176.32.98.166 (176.32.98.166), Dst: 10.207.175.99 (10.207.175.99)
Transmission Control Protocol, Src Port: 80 (80), Dst Port: 35755 (35755), Seq: 13468, Ack: 247, Len: 1448

No.     Time            Source                Destination           Protocol Length Info
     33 17:49:11.203065 176.32.98.166         10.207.175.99         TCP      1516   [TCP segment of a reassembled PDU]

Frame 33: 1516 bytes on wire (12128 bits), 1516 bytes captured (12128 bits)
Linux cooked capture
Internet Protocol Version 4, Src: 176.32.98.166 (176.32.98.166), Dst: 10.207.175.99 (10.207.175.99)
Transmission Control Protocol, Src Port: 80 (80), Dst Port: 35755 (35755), Seq: 14916, Ack: 247, Len: 1448

No.     Time            Source                Destination           Protocol Length Info
     34 17:49:11.203110 176.32.98.166         10.207.175.99         TCP      80     [TCP segment of a reassembled PDU]

Frame 34: 80 bytes on wire (640 bits), 80 bytes captured (640 bits)
Linux cooked capture
Internet Protocol Version 4, Src: 176.32.98.166 (176.32.98.166), Dst: 10.207.175.99 (10.207.175.99)
Transmission Control Protocol, Src Port: 80 (80), Dst Port: 35755 (35755), Seq: 16364, Ack: 247, Len: 12

No.     Time            Source                Destination           Protocol Length Info
     35 17:49:11.203579 10.207.175.99         176.32.98.166         TCP      68     35755→80 [ACK] Seq=247 Ack=14916 Win=49408 Len=0 TSval=73350 TSecr=4128253204

Frame 35: 68 bytes on wire (544 bits), 68 bytes captured (544 bits)
Linux cooked capture
Internet Protocol Version 4, Src: 10.207.175.99 (10.207.175.99), Dst: 176.32.98.166 (176.32.98.166)
Transmission Control Protocol, Src Port: 35755 (35755), Dst Port: 80 (80), Seq: 247, Ack: 14916, Len: 0

No.     Time            Source                Destination           Protocol Length Info
     36 17:49:11.204365 10.207.175.99         176.32.98.166         TCP      68     35755→80 [ACK] Seq=247 Ack=16364 Win=52288 Len=0 TSval=73350 TSecr=4128253204

Frame 36: 68 bytes on wire (544 bits), 68 bytes captured (544 bits)
Linux cooked capture
Internet Protocol Version 4, Src: 10.207.175.99 (10.207.175.99), Dst: 176.32.98.166 (176.32.98.166)
Transmission Control Protocol, Src Port: 35755 (35755), Dst Port: 80 (80), Seq: 247, Ack: 16364, Len: 0

No.     Time            Source                Destination           Protocol Length Info
     37 17:49:11.204435 176.32.98.166         10.207.175.99         TCP      1516   [TCP segment of a reassembled PDU]

Frame 37: 1516 bytes on wire (12128 bits), 1516 bytes captured (12128 bits)
Linux cooked capture
Internet Protocol Version 4, Src: 176.32.98.166 (176.32.98.166), Dst: 10.207.175.99 (10.207.175.99)
Transmission Control Protocol, Src Port: 80 (80), Dst Port: 35755 (35755), Seq: 16376, Ack: 247, Len: 1448

No.     Time            Source                Destination           Protocol Length Info
     38 17:49:11.204480 176.32.98.166         10.207.175.99         TCP      1516   [TCP segment of a reassembled PDU]

Frame 38: 1516 bytes on wire (12128 bits), 1516 bytes captured (12128 bits)
Linux cooked capture
Internet Protocol Version 4, Src: 176.32.98.166 (176.32.98.166), Dst: 10.207.175.99 (10.207.175.99)
Transmission Control Protocol, Src Port: 80 (80), Dst Port: 35755 (35755), Seq: 17824, Ack: 247, Len: 1448

No.     Time            Source                Destination           Protocol Length Info
     39 17:49:11.204518 176.32.98.166         10.207.175.99         TCP      1516   [TCP segment of a reassembled PDU]

Frame 39: 1516 bytes on wire (12128 bits), 1516 bytes captured (12128 bits)
Linux cooked capture
Internet Protocol Version 4, Src: 176.32.98.166 (176.32.98.166), Dst: 10.207.175.99 (10.207.175.99)
Transmission Control Protocol, Src Port: 80 (80), Dst Port: 35755 (35755), Seq: 19272, Ack: 247, Len: 1448

No.     Time            Source                Destination           Protocol Length Info
     40 17:49:11.204556 176.32.98.166         10.207.175.99         TCP      1516   [TCP segment of a reassembled PDU]

Frame 40: 1516 bytes on wire (12128 bits), 1516 bytes captured (12128 bits)
Linux cooked capture
Internet Protocol Version 4, Src: 176.32.98.166 (176.32.98.166), Dst: 10.207.175.99 (10.207.175.99)
Transmission Control Protocol, Src Port: 80 (80), Dst Port: 35755 (35755), Seq: 20720, Ack: 247, Len: 1448

No.     Time            Source                Destination           Protocol Length Info
     41 17:49:11.204591 176.32.98.166         10.207.175.99         TCP      96     [TCP segment of a reassembled PDU]

Frame 41: 96 bytes on wire (768 bits), 96 bytes captured (768 bits)
Linux cooked capture
Internet Protocol Version 4, Src: 176.32.98.166 (176.32.98.166), Dst: 10.207.175.99 (10.207.175.99)
Transmission Control Protocol, Src Port: 80 (80), Dst Port: 35755 (35755), Seq: 22168, Ack: 247, Len: 28

No.     Time            Source                Destination           Protocol Length Info
     42 17:49:11.204627 176.32.98.166         10.207.175.99         TCP      1516   [TCP segment of a reassembled PDU]

Frame 42: 1516 bytes on wire (12128 bits), 1516 bytes captured (12128 bits)
Linux cooked capture
Internet Protocol Version 4, Src: 176.32.98.166 (176.32.98.166), Dst: 10.207.175.99 (10.207.175.99)
Transmission Control Protocol, Src Port: 80 (80), Dst Port: 35755 (35755), Seq: 22196, Ack: 247, Len: 1448

No.     Time            Source                Destination           Protocol Length Info
     43 17:49:11.204666 176.32.98.166         10.207.175.99         TCP      80     [TCP segment of a reassembled PDU]

Frame 43: 80 bytes on wire (640 bits), 80 bytes captured (640 bits)
Linux cooked capture
Internet Protocol Version 4, Src: 176.32.98.166 (176.32.98.166), Dst: 10.207.175.99 (10.207.175.99)
Transmission Control Protocol, Src Port: 80 (80), Dst Port: 35755 (35755), Seq: 23644, Ack: 247, Len: 12

No.     Time            Source                Destination           Protocol Length Info
     44 17:49:11.204706 176.32.98.166         10.207.175.99         TCP      1516   [TCP segment of a reassembled PDU]

Frame 44: 1516 bytes on wire (12128 bits), 1516 bytes captured (12128 bits)
Linux cooked capture
Internet Protocol Version 4, Src: 176.32.98.166 (176.32.98.166), Dst: 10.207.175.99 (10.207.175.99)
Transmission Control Protocol, Src Port: 80 (80), Dst Port: 35755 (35755), Seq: 23656, Ack: 247, Len: 1448

No.     Time            Source                Destination           Protocol Length Info
     45 17:49:11.204742 176.32.98.166         10.207.175.99         TCP      1516   [TCP segment of a reassembled PDU]

Frame 45: 1516 bytes on wire (12128 bits), 1516 bytes captured (12128 bits)
Linux cooked capture
Internet Protocol Version 4, Src: 176.32.98.166 (176.32.98.166), Dst: 10.207.175.99 (10.207.175.99)
Transmission Control Protocol, Src Port: 80 (80), Dst Port: 35755 (35755), Seq: 25104, Ack: 247, Len: 1448

No.     Time            Source                Destination           Protocol Length Info
     46 17:49:11.205791 176.32.98.166         10.207.175.99         TCP      1516   [TCP segment of a reassembled PDU]

Frame 46: 1516 bytes on wire (12128 bits), 1516 bytes captured (12128 bits)
Linux cooked capture
Internet Protocol Version 4, Src: 176.32.98.166 (176.32.98.166), Dst: 10.207.175.99 (10.207.175.99)
Transmission Control Protocol, Src Port: 80 (80), Dst Port: 35755 (35755), Seq: 26552, Ack: 247, Len: 1448

No.     Time            Source                Destination           Protocol Length Info
     47 17:49:11.205849 176.32.98.166         10.207.175.99         TCP      1516   [TCP segment of a reassembled PDU]

Frame 47: 1516 bytes on wire (12128 bits), 1516 bytes captured (12128 bits)
Linux cooked capture
Internet Protocol Version 4, Src: 176.32.98.166 (176.32.98.166), Dst: 10.207.175.99 (10.207.175.99)
Transmission Control Protocol, Src Port: 80 (80), Dst Port: 35755 (35755), Seq: 28000, Ack: 247, Len: 1448

No.     Time            Source                Destination           Protocol Length Info
     48 17:49:11.205890 176.32.98.166         10.207.175.99         TCP      1516   [TCP segment of a reassembled PDU]

Frame 48: 1516 bytes on wire (12128 bits), 1516 bytes captured (12128 bits)
Linux cooked capture
Internet Protocol Version 4, Src: 176.32.98.166 (176.32.98.166), Dst: 10.207.175.99 (10.207.175.99)
Transmission Control Protocol, Src Port: 80 (80), Dst Port: 35755 (35755), Seq: 29448, Ack: 247, Len: 1448

No.     Time            Source                Destination           Protocol Length Info
     49 17:49:11.205927 176.32.98.166         10.207.175.99         TCP      101    [TCP segment of a reassembled PDU]

Frame 49: 101 bytes on wire (808 bits), 101 bytes captured (808 bits)
Linux cooked capture
Internet Protocol Version 4, Src: 176.32.98.166 (176.32.98.166), Dst: 10.207.175.99 (10.207.175.99)
Transmission Control Protocol, Src Port: 80 (80), Dst Port: 35755 (35755), Seq: 30896, Ack: 247, Len: 33

No.     Time            Source                Destination           Protocol Length Info
     50 17:49:11.206312 10.207.175.99         176.32.98.166         TCP      68     35755→80 [ACK] Seq=247 Ack=16376 Win=52288 Len=0 TSval=73350 TSecr=4128253204

Frame 50: 68 bytes on wire (544 bits), 68 bytes captured (544 bits)
Linux cooked capture
Internet Protocol Version 4, Src: 10.207.175.99 (10.207.175.99), Dst: 176.32.98.166 (176.32.98.166)
Transmission Control Protocol, Src Port: 35755 (35755), Dst Port: 80 (80), Seq: 247, Ack: 16376, Len: 0

No.     Time            Source                Destination           Protocol Length Info
     51 17:49:11.206576 10.207.175.99         176.32.98.166         TCP      68     35755→80 [ACK] Seq=247 Ack=17824 Win=55168 Len=0 TSval=73350 TSecr=4128253204

Frame 51: 68 bytes on wire (544 bits), 68 bytes captured (544 bits)
Linux cooked capture
Internet Protocol Version 4, Src: 10.207.175.99 (10.207.175.99), Dst: 176.32.98.166 (176.32.98.166)
Transmission Control Protocol, Src Port: 35755 (35755), Dst Port: 80 (80), Seq: 247, Ack: 17824, Len: 0

No.     Time            Source                Destination           Protocol Length Info
     52 17:49:11.207210 10.207.175.99         176.32.98.166         TCP      68     35755→80 [ACK] Seq=247 Ack=19272 Win=58048 Len=0 TSval=73350 TSecr=4128253204

Frame 52: 68 bytes on wire (544 bits), 68 bytes captured (544 bits)
Linux cooked capture
Internet Protocol Version 4, Src: 10.207.175.99 (10.207.175.99), Dst: 176.32.98.166 (176.32.98.166)
Transmission Control Protocol, Src Port: 35755 (35755), Dst Port: 80 (80), Seq: 247, Ack: 19272, Len: 0

No.     Time            Source                Destination           Protocol Length Info
     53 17:49:11.207473 10.207.175.99         176.32.98.166         TCP      68     35755→80 [ACK] Seq=247 Ack=20720 Win=60992 Len=0 TSval=73350 TSecr=4128253204

Frame 53: 68 bytes on wire (544 bits), 68 bytes captured (544 bits)
Linux cooked capture
Internet Protocol Version 4, Src: 10.207.175.99 (10.207.175.99), Dst: 176.32.98.166 (176.32.98.166)
Transmission Control Protocol, Src Port: 35755 (35755), Dst Port: 80 (80), Seq: 247, Ack: 20720, Len: 0

No.     Time            Source                Destination           Protocol Length Info
     54 17:49:11.207724 10.207.175.99         176.32.98.166         TCP      68     35755→80 [ACK] Seq=247 Ack=22168 Win=63872 Len=0 TSval=73350 TSecr=4128253204

Frame 54: 68 bytes on wire (544 bits), 68 bytes captured (544 bits)
Linux cooked capture
Internet Protocol Version 4, Src: 10.207.175.99 (10.207.175.99), Dst: 176.32.98.166 (176.32.98.166)
Transmission Control Protocol, Src Port: 35755 (35755), Dst Port: 80 (80), Seq: 247, Ack: 22168, Len: 0

No.     Time            Source                Destination           Protocol Length Info
     55 17:49:11.208328 10.207.175.99         176.32.98.166         TCP      68     35755→80 [ACK] Seq=247 Ack=23644 Win=66752 Len=0 TSval=73351 TSecr=4128253204

Frame 55: 68 bytes on wire (544 bits), 68 bytes captured (544 bits)
Linux cooked capture
Internet Protocol Version 4, Src: 10.207.175.99 (10.207.175.99), Dst: 176.32.98.166 (176.32.98.166)
Transmission Control Protocol, Src Port: 35755 (35755), Dst Port: 80 (80), Seq: 247, Ack: 23644, Len: 0

No.     Time            Source                Destination           Protocol Length Info
     56 17:49:11.208990 10.207.175.99         176.32.98.166         TCP      68     35755→80 [ACK] Seq=247 Ack=25104 Win=69632 Len=0 TSval=73351 TSecr=4128253205

Frame 56: 68 bytes on wire (544 bits), 68 bytes captured (544 bits)
Linux cooked capture
Internet Protocol Version 4, Src: 10.207.175.99 (10.207.175.99), Dst: 176.32.98.166 (176.32.98.166)
Transmission Control Protocol, Src Port: 35755 (35755), Dst Port: 80 (80), Seq: 247, Ack: 25104, Len: 0

No.     Time            Source                Destination           Protocol Length Info
     57 17:49:11.209383 10.207.175.99         176.32.98.166         TCP      68     35755→80 [ACK] Seq=247 Ack=26552 Win=72576 Len=0 TSval=73351 TSecr=4128253205

Frame 57: 68 bytes on wire (544 bits), 68 bytes captured (544 bits)
Linux cooked capture
Internet Protocol Version 4, Src: 10.207.175.99 (10.207.175.99), Dst: 176.32.98.166 (176.32.98.166)
Transmission Control Protocol, Src Port: 35755 (35755), Dst Port: 80 (80), Seq: 247, Ack: 26552, Len: 0

No.     Time            Source                Destination           Protocol Length Info
     58 17:49:11.209682 10.207.175.99         176.32.98.166         TCP      68     35755→80 [ACK] Seq=247 Ack=28000 Win=75456 Len=0 TSval=73351 TSecr=4128253205

Frame 58: 68 bytes on wire (544 bits), 68 bytes captured (544 bits)
Linux cooked capture
Internet Protocol Version 4, Src: 10.207.175.99 (10.207.175.99), Dst: 176.32.98.166 (176.32.98.166)
Transmission Control Protocol, Src Port: 35755 (35755), Dst Port: 80 (80), Seq: 247, Ack: 28000, Len: 0

No.     Time            Source                Destination           Protocol Length Info
     59 17:49:11.210122 10.207.175.99         176.32.98.166         TCP      68     35755→80 [ACK] Seq=247 Ack=29448 Win=78336 Len=0 TSval=73351 TSecr=4128253205

Frame 59: 68 bytes on wire (544 bits), 68 bytes captured (544 bits)
Linux cooked capture
Internet Protocol Version 4, Src: 10.207.175.99 (10.207.175.99), Dst: 176.32.98.166 (176.32.98.166)
Transmission Control Protocol, Src Port: 35755 (35755), Dst Port: 80 (80), Seq: 247, Ack: 29448, Len: 0

No.     Time            Source                Destination           Protocol Length Info
     60 17:49:11.210408 10.207.175.99         176.32.98.166         TCP      68     35755→80 [ACK] Seq=247 Ack=30896 Win=81216 Len=0 TSval=73351 TSecr=4128253205

Frame 60: 68 bytes on wire (544 bits), 68 bytes captured (544 bits)
Linux cooked capture
Internet Protocol Version 4, Src: 10.207.175.99 (10.207.175.99), Dst: 176.32.98.166 (176.32.98.166)
Transmission Control Protocol, Src Port: 35755 (35755), Dst Port: 80 (80), Seq: 247, Ack: 30896, Len: 0

No.     Time            Source                Destination           Protocol Length Info
     61 17:49:11.213933 10.207.175.99         176.32.98.166         TCP      68     35755→80 [ACK] Seq=247 Ack=30929 Win=81216 Len=0 TSval=73351 TSecr=4128253205

Frame 61: 68 bytes on wire (544 bits), 68 bytes captured (544 bits)
Linux cooked capture
Internet Protocol Version 4, Src: 10.207.175.99 (10.207.175.99), Dst: 176.32.98.166 (176.32.98.166)
Transmission Control Protocol, Src Port: 35755 (35755), Dst Port: 80 (80), Seq: 247, Ack: 30929, Len: 0

No.     Time            Source                Destination           Protocol Length Info
     62 17:49:11.227825 176.32.98.166         10.207.175.99         TCP      1516   [TCP segment of a reassembled PDU]

Frame 62: 1516 bytes on wire (12128 bits), 1516 bytes captured (12128 bits)
Linux cooked capture
Internet Protocol Version 4, Src: 176.32.98.166 (176.32.98.166), Dst: 10.207.175.99 (10.207.175.99)
Transmission Control Protocol, Src Port: 80 (80), Dst Port: 35755 (35755), Seq: 30929, Ack: 247, Len: 1448

No.     Time            Source                Destination           Protocol Length Info
     63 17:49:11.229089 10.207.175.99         176.32.98.166         TCP      68     35755→80 [ACK] Seq=247 Ack=32377 Win=84160 Len=0 TSval=73353 TSecr=4128253228

Frame 63: 68 bytes on wire (544 bits), 68 bytes captured (544 bits)
Linux cooked capture
Internet Protocol Version 4, Src: 10.207.175.99 (10.207.175.99), Dst: 176.32.98.166 (176.32.98.166)
Transmission Control Protocol, Src Port: 35755 (35755), Dst Port: 80 (80), Seq: 247, Ack: 32377, Len: 0

No.     Time            Source                Destination           Protocol Length Info
     64 17:49:11.229316 176.32.98.166         10.207.175.99         TCP      1516   [TCP segment of a reassembled PDU]

Frame 64: 1516 bytes on wire (12128 bits), 1516 bytes captured (12128 bits)
Linux cooked capture
Internet Protocol Version 4, Src: 176.32.98.166 (176.32.98.166), Dst: 10.207.175.99 (10.207.175.99)
Transmission Control Protocol, Src Port: 80 (80), Dst Port: 35755 (35755), Seq: 32377, Ack: 247, Len: 1448

No.     Time            Source                Destination           Protocol Length Info
     65 17:49:11.229422 10.207.175.99         176.32.98.166         TCP      68     35755→80 [ACK] Seq=247 Ack=33825 Win=87040 Len=0 TSval=73353 TSecr=4128253228

Frame 65: 68 bytes on wire (544 bits), 68 bytes captured (544 bits)
Linux cooked capture
Internet Protocol Version 4, Src: 10.207.175.99 (10.207.175.99), Dst: 176.32.98.166 (176.32.98.166)
Transmission Control Protocol, Src Port: 35755 (35755), Dst Port: 80 (80), Seq: 247, Ack: 33825, Len: 0

No.     Time            Source                Destination           Protocol Length Info
     66 17:49:11.230996 176.32.98.166         10.207.175.99         TCP      1516   [TCP segment of a reassembled PDU]

Frame 66: 1516 bytes on wire (12128 bits), 1516 bytes captured (12128 bits)
Linux cooked capture
Internet Protocol Version 4, Src: 176.32.98.166 (176.32.98.166), Dst: 10.207.175.99 (10.207.175.99)
Transmission Control Protocol, Src Port: 80 (80), Dst Port: 35755 (35755), Seq: 33825, Ack: 247, Len: 1448

No.     Time            Source                Destination           Protocol Length Info
     67 17:49:11.231073 176.32.98.166         10.207.175.99         TCP      337    [TCP segment of a reassembled PDU]

Frame 67: 337 bytes on wire (2696 bits), 337 bytes captured (2696 bits)
Linux cooked capture
Internet Protocol Version 4, Src: 176.32.98.166 (176.32.98.166), Dst: 10.207.175.99 (10.207.175.99)
Transmission Control Protocol, Src Port: 80 (80), Dst Port: 35755 (35755), Seq: 35273, Ack: 247, Len: 269

No.     Time            Source                Destination           Protocol Length Info
     68 17:49:11.231774 10.207.175.99         176.32.98.166         TCP      68     35755→80 [ACK] Seq=247 Ack=35273 Win=89920 Len=0 TSval=73353 TSecr=4128253231

Frame 68: 68 bytes on wire (544 bits), 68 bytes captured (544 bits)
Linux cooked capture
Internet Protocol Version 4, Src: 10.207.175.99 (10.207.175.99), Dst: 176.32.98.166 (176.32.98.166)
Transmission Control Protocol, Src Port: 35755 (35755), Dst Port: 80 (80), Seq: 247, Ack: 35273, Len: 0

No.     Time            Source                Destination           Protocol Length Info
     69 17:49:11.232064 10.207.175.99         176.32.98.166         TCP      68     35755→80 [ACK] Seq=247 Ack=35542 Win=92800 Len=0 TSval=73353 TSecr=4128253231

Frame 69: 68 bytes on wire (544 bits), 68 bytes captured (544 bits)
Linux cooked capture
Internet Protocol Version 4, Src: 10.207.175.99 (10.207.175.99), Dst: 176.32.98.166 (176.32.98.166)
Transmission Control Protocol, Src Port: 35755 (35755), Dst Port: 80 (80), Seq: 247, Ack: 35542, Len: 0

No.     Time            Source                Destination           Protocol Length Info
     70 17:49:11.332104 176.32.98.166         10.207.175.99         TCP      1516   [TCP segment of a reassembled PDU]

Frame 70: 1516 bytes on wire (12128 bits), 1516 bytes captured (12128 bits)
Linux cooked capture
Internet Protocol Version 4, Src: 176.32.98.166 (176.32.98.166), Dst: 10.207.175.99 (10.207.175.99)
Transmission Control Protocol, Src Port: 80 (80), Dst Port: 35755 (35755), Seq: 35542, Ack: 247, Len: 1448

No.     Time            Source                Destination           Protocol Length Info
     71 17:49:11.332361 176.32.98.166         10.207.175.99         TCP      631    [TCP segment of a reassembled PDU]

Frame 71: 631 bytes on wire (5048 bits), 631 bytes captured (5048 bits)
Linux cooked capture
Internet Protocol Version 4, Src: 176.32.98.166 (176.32.98.166), Dst: 10.207.175.99 (10.207.175.99)
Transmission Control Protocol, Src Port: 80 (80), Dst Port: 35755 (35755), Seq: 36990, Ack: 247, Len: 563

No.     Time            Source                Destination           Protocol Length Info
     72 17:49:11.332890 176.32.98.166         10.207.175.99         TCP      1516   [TCP segment of a reassembled PDU]

Frame 72: 1516 bytes on wire (12128 bits), 1516 bytes captured (12128 bits)
Linux cooked capture
Internet Protocol Version 4, Src: 176.32.98.166 (176.32.98.166), Dst: 10.207.175.99 (10.207.175.99)
Transmission Control Protocol, Src Port: 80 (80), Dst Port: 35755 (35755), Seq: 37553, Ack: 247, Len: 1448

No.     Time            Source                Destination           Protocol Length Info
     73 17:49:11.333012 176.32.98.166         10.207.175.99         TCP      1516   [TCP segment of a reassembled PDU]

Frame 73: 1516 bytes on wire (12128 bits), 1516 bytes captured (12128 bits)
Linux cooked capture
Internet Protocol Version 4, Src: 176.32.98.166 (176.32.98.166), Dst: 10.207.175.99 (10.207.175.99)
Transmission Control Protocol, Src Port: 80 (80), Dst Port: 35755 (35755), Seq: 39001, Ack: 247, Len: 1448

No.     Time            Source                Destination           Protocol Length Info
     74 17:49:11.333085 176.32.98.166         10.207.175.99         TCP      140    [TCP segment of a reassembled PDU]

Frame 74: 140 bytes on wire (1120 bits), 140 bytes captured (1120 bits)
Linux cooked capture
Internet Protocol Version 4, Src: 176.32.98.166 (176.32.98.166), Dst: 10.207.175.99 (10.207.175.99)
