No.     Time            Source                Destination           Protocol Length Info
      4 17:49:10.774329 10.207.175.99         176.32.98.166         HTTP     314    GET / HTTP/1.1 

Frame 4: 314 bytes on wire (2512 bits), 314 bytes captured (2512 bits)
Linux cooked capture
Internet Protocol Version 4, Src: 10.207.175.99 (10.207.175.99), Dst: 176.32.98.166 (176.32.98.166)
Transmission Control Protocol, Src Port: 35755 (35755), Dst Port: 80 (80), Seq: 1, Ack: 1, Len: 246
Hypertext Transfer Protocol
    GET / HTTP/1.1\r\n
    Accept-Encoding: gzip\r\n
    Host: www.amazon.com\r\n
    Connection: Keep-Alive\r\n
    User-Agent: Mozilla/5.0 (Linux; Android 4.4.2; SM-G900F Build/KOT49H) AppleWebKit/537.36 (KHTML, like Gecko) Version/4.0 Chrome/30.0.0.0 Mobile Safari/537.36\r\n
    \r\n
    [Full request URI: http://www.amazon.com/]
    [HTTP request 1/1]
    [Response in frame: 135]

No.     Time            Source                Destination           Protocol Length Info
    135 17:49:11.731366 176.32.98.166         10.207.175.99         HTTP     369    HTTP/1.1 200 OK  (text/html)

Frame 135: 369 bytes on wire (2952 bits), 369 bytes captured (2952 bits)
Linux cooked capture
Internet Protocol Version 4, Src: 176.32.98.166 (176.32.98.166), Dst: 10.207.175.99 (10.207.175.99)
Transmission Control Protocol, Src Port: 80 (80), Dst Port: 35755 (35755), Seq: 62454, Ack: 247, Len: 301
[68 Reassembled TCP Segments (62754 bytes): #6(1448), #7(1448), #8(1448), #9(338), #10(1448), #11(14), #12(1448), #13(623), #22(1118), #24(1448), #25(81), #26(1268), #27(1337), #32(1448), #33(1448), #34(12), #37(1448), #38(1448), #39(1448),]
Hypertext Transfer Protocol
    HTTP/1.1 200 OK\r\n
    Date: Wed, 14 Oct 2015 15:50:01 GMT\r\n
    Server: Server\r\n
    Set-Cookie: skin=noskin; path=/; domain=.amazon.com\r\n
    Pragma: no-cache\r\n
    x-amz-id-1: 03CDEMQYPH35FZDZ6KQJ\r\n
    p3p: policyref="http://www.amazon.com/w3c/p3p.xml",CP="CAO DSP LAW CUR ADM IVAo IVDo CONo OTPo OUR DELi PUBi OTRi BUS PHY ONL UNI PUR FIN COM NAV INT DEM CNT STA HEA PRE LOC GOV OTC "\r\n
    Cache-Control: no-cache, no-transform\r\n
    x-frame-options: SAMEORIGIN\r\n
    Expires: -1\r\n
    x-amz-id-2: BsGBO7SNpcWZx5ifIe5726qPBQTqWa78Dk9IDod5+/1F8mEToGL6eKK4hFaYzgMB\r\n
    Vary: Accept-Encoding,User-Agent\r\n
    Content-Encoding: gzip\r\n
    Content-Type: text/html; charset=UTF-8\r\n
    Set-Cookie: x-wl-uid=1BzNkCuA4oTxi8TG97wQsFDTqfam1smK+ZhjQXrey2cCfEq09JaxTN2R2++vEYrrQA3hEqYYhd94=; path=/; domain=.amazon.com; expires=Tue, 01-Jan-2036 08:00:01 GMT\r\n
    Set-Cookie: session-id-time=2082787201l; path=/; domain=.amazon.com; expires=Tue, 01-Jan-2036 08:00:01 GMT\r\n
    Set-Cookie: session-id=190-6529896-4644741; path=/; domain=.amazon.com; expires=Tue, 01-Jan-2036 08:00:01 GMT\r\n
    Transfer-Encoding: chunked\r\n
    \r\n
    [HTTP response 1/1]
    [Time since request: 0.957037000 seconds]
    [Request in frame: 4]
    HTTP chunked response
    Content-encoded entity body (gzip): 61441 bytes -> 336890 bytes
Line-based text data: text/html

No.     Time            Source                Destination           Protocol Length Info
    140 17:49:12.150747 10.207.175.99         88.221.117.200        HTTP     578    GET /images/G/01/AUIClients/NavAuiMobileAssetsSmart-2e441164b30f19a5ca7e998e243423f2486a2b7f._V2_.css HTTP/1.1 

Frame 140: 578 bytes on wire (4624 bits), 578 bytes captured (4624 bits)
Linux cooked capture
Internet Protocol Version 4, Src: 10.207.175.99 (10.207.175.99), Dst: 88.221.117.200 (88.221.117.200)
Transmission Control Protocol, Src Port: 47561 (47561), Dst Port: 80 (80), Seq: 1, Ack: 1, Len: 510
Hypertext Transfer Protocol
    GET /images/G/01/AUIClients/NavAuiMobileAssetsSmart-2e441164b30f19a5ca7e998e243423f2486a2b7f._V2_.css HTTP/1.1\r\n
    Host: z-ecx.images-amazon.com\r\n
    Connection: keep-alive\r\n
    Accept: text/css,*/*;q=0.1\r\n
    User-Agent: Mozilla/5.0 (Linux; Android 4.4.2; SM-G900F Build/KOT49H) AppleWebKit/537.36 (KHTML, like Gecko) Version/4.0 Chrome/30.0.0.0 Mobile Safari/537.36\r\n
    Referer: http://www.amazon.com/\r\n
    Accept-Encoding: gzip,deflate\r\n
    Accept-Language: de-DE,en-US;q=0.8\r\n
    X-Requested-With: com.swissqual.qualipoc.gui.control\r\n
    \r\n
    [Full request URI: http://z-ecx.images-amazon.com/images/G/01/AUIClients/NavAuiMobileAssetsSmart-2e441164b30f19a5ca7e998e243423f2486a2b7f._V2_.css]
    [HTTP request 1/2]
    [Response in frame: 145]
    [Next request in frame: 513]

No.     Time            Source                Destination           Protocol Length Info
    141 17:49:12.158960 10.207.175.99         54.239.22.213         HTTP     1200   GET /1/batch/1/OP/ATVPDKIKX0DER:190-6529896-4644741:03CDEMQYPH35FZDZ6KQJ$uedata=s:%2Fuedata%2Fnvp%2Funsticky%2F190-6529896-4644741%2FGateway%2Fntpoffrw%3Fstaticb%26id%3D03CDEMQYPH35FZDZ6KQJ%26pty%3Dgateway-phone-web%26spty%3Dsmartphone%26pti%3Dmobile:1000 HTTP/1.1 

Frame 141: 1200 bytes on wire (9600 bits), 1200 bytes captured (9600 bits)
Linux cooked capture
Internet Protocol Version 4, Src: 10.207.175.99 (10.207.175.99), Dst: 54.239.22.213 (54.239.22.213)
Transmission Control Protocol, Src Port: 33477 (33477), Dst Port: 80 (80), Seq: 1, Ack: 1, Len: 1132
Hypertext Transfer Protocol
     [truncated]GET /1/batch/1/OP/ATVPDKIKX0DER:190-6529896-4644741:03CDEMQYPH35FZDZ6KQJ$uedata=s:%2Fuedata%2Fnvp%2Funsticky%2F190-6529896-4644741%2FGateway%2Fntpoffrw%3Fstaticb%26id%3D03CDEMQYPH35FZDZ6KQJ%26pty%3Dgateway-phone-web%26spty%3Dsm
    Host: fls-na.amazon.com\r\n
    Connection: keep-alive\r\n
    Accept: image/webp,*/*;q=0.8\r\n
    User-Agent: Mozilla/5.0 (Linux; Android 4.4.2; SM-G900F Build/KOT49H) AppleWebKit/537.36 (KHTML, like Gecko) Version/4.0 Chrome/30.0.0.0 Mobile Safari/537.36\r\n
    Referer: http://www.amazon.com/\r\n
    Accept-Encoding: gzip,deflate\r\n
    Accept-Language: de-DE,en-US;q=0.8\r\n
     [truncated]Cookie: x-wl-uid=1VPCmaoD5Lbg+NVfKeaEnQtipL1OQu2I9OlYzxV7JSRfzzDPtmYmnfhlvMXuHKVic4+6VqG1Yd1k=; session-token=d6c7Hcouf7x/BgtPnkO26tfN43zPfxvc1QZnhAFkglhuzmzSo++Bqf+riO6sl4K6jAHuD8bFfvBVQpP4hYhpv+AF/gyDHwtwX/6mkDeqoQLo64YShWbF5
    X-Requested-With: com.swissqual.qualipoc.gui.control\r\n
    \r\n
    [Full request URI [truncated]: http://fls-na.amazon.com/1/batch/1/OP/ATVPDKIKX0DER:190-6529896-4644741:03CDEMQYPH35FZDZ6KQJ$uedata=s:%2Fuedata%2Fnvp%2Funsticky%2F190-6529896-4644741%2FGateway%2Fntpoffrw%3Fstaticb%26id%3D03CDEMQYPH35FZDZ6KQJ]
    [HTTP request 1/3]
    [Response in frame: 172]
    [Next request in frame: 511]

No.     Time            Source                Destination           Protocol Length Info
    145 17:49:12.227332 88.221.117.200        10.207.175.99         HTTP     1506   HTTP/1.1 200 OK  (text/css)

Frame 145: 1506 bytes on wire (12048 bits), 1506 bytes captured (12048 bits)
Linux cooked capture
Internet Protocol Version 4, Src: 88.221.117.200 (88.221.117.200), Dst: 10.207.175.99 (10.207.175.99)
Transmission Control Protocol, Src Port: 80 (80), Dst Port: 47561 (47561), Seq: 1449, Ack: 511, Len: 1438
[2 Reassembled TCP Segments (2886 bytes): #143(1448), #145(1438)]
Hypertext Transfer Protocol
    HTTP/1.1 200 OK\r\n
    Server: nginx\r\n
    Content-Type: text/css\r\n
    Last-Modified: Mon, 27 Jul 2015 01:00:49 GMT\r\n
    Access-Control-Allow-Origin: *\r\n
    Vary: Accept-Encoding\r\n
    Content-Encoding: gzip\r\n
    Cache-Control: public, max-age=626830999\r\n
    Expires: Sat, 25 Aug 2035 15:33:21 GMT\r\n
    Date: Wed, 14 Oct 2015 15:50:02 GMT\r\n
    Content-Length: 2538\r\n
    Connection: keep-alive\r\n
    \r\n
    [HTTP response 1/2]
    [Time since request: 0.076585000 seconds]
    [Request in frame: 140]
    [Next request in frame: 513]
    [Next response in frame: 531]
    Content-encoded entity body (gzip): 2538 bytes -> 12210 bytes
Line-based text data: text/css

No.     Time            Source                Destination           Protocol Length Info
    147 17:49:12.271500 10.207.175.99         54.240.162.96         HTTP     544    GET /images/G/01/gno/sprites/global-sprite-32-v1._V332842812_.png HTTP/1.1 

Frame 147: 544 bytes on wire (4352 bits), 544 bytes captured (4352 bits)
Linux cooked capture
Internet Protocol Version 4, Src: 10.207.175.99 (10.207.175.99), Dst: 54.240.162.96 (54.240.162.96)
Transmission Control Protocol, Src Port: 54726 (54726), Dst Port: 80 (80), Seq: 1, Ack: 1, Len: 476
Hypertext Transfer Protocol
    GET /images/G/01/gno/sprites/global-sprite-32-v1._V332842812_.png HTTP/1.1\r\n
    Host: g-ecx.images-amazon.com\r\n
    Connection: keep-alive\r\n
    Accept: image/webp,*/*;q=0.8\r\n
    User-Agent: Mozilla/5.0 (Linux; Android 4.4.2; SM-G900F Build/KOT49H) AppleWebKit/537.36 (KHTML, like Gecko) Version/4.0 Chrome/30.0.0.0 Mobile Safari/537.36\r\n
    Referer: http://www.amazon.com/\r\n
    Accept-Encoding: gzip,deflate\r\n
    Accept-Language: de-DE,en-US;q=0.8\r\n
    X-Requested-With: com.swissqual.qualipoc.gui.control\r\n
    \r\n
    [Full request URI: http://g-ecx.images-amazon.com/images/G/01/gno/sprites/global-sprite-32-v1._V332842812_.png]
    [HTTP request 1/2]
    [Response in frame: 174]
    [Next request in frame: 423]

No.     Time            Source                Destination           Protocol Length Info
    148 17:49:12.273879 10.207.175.99         54.240.162.96         HTTP     583    GET /images/G/01/kindle/merch/2015/campaign/E/ECHO-gw-d-00price-us-1242x375._UX414_SX414_V313265211_.jpg HTTP/1.1 

Frame 148: 583 bytes on wire (4664 bits), 583 bytes captured (4664 bits)
Linux cooked capture
Internet Protocol Version 4, Src: 10.207.175.99 (10.207.175.99), Dst: 54.240.162.96 (54.240.162.96)
Transmission Control Protocol, Src Port: 54732 (54732), Dst Port: 80 (80), Seq: 1, Ack: 1, Len: 515
Hypertext Transfer Protocol
    GET /images/G/01/kindle/merch/2015/campaign/E/ECHO-gw-d-00price-us-1242x375._UX414_SX414_V313265211_.jpg HTTP/1.1\r\n
    Host: g-ecx.images-amazon.com\r\n
    Connection: keep-alive\r\n
    Accept: image/webp,*/*;q=0.8\r\n
    User-Agent: Mozilla/5.0 (Linux; Android 4.4.2; SM-G900F Build/KOT49H) AppleWebKit/537.36 (KHTML, like Gecko) Version/4.0 Chrome/30.0.0.0 Mobile Safari/537.36\r\n
    Referer: http://www.amazon.com/\r\n
    Accept-Encoding: gzip,deflate\r\n
    Accept-Language: de-DE,en-US;q=0.8\r\n
    X-Requested-With: com.swissqual.qualipoc.gui.control\r\n
    \r\n
    [Full request URI: http://g-ecx.images-amazon.com/images/G/01/kindle/merch/2015/campaign/E/ECHO-gw-d-00price-us-1242x375._UX414_SX414_V313265211_.jpg]
    [HTTP request 1/6]
    [Response in frame: 186]
    [Next request in frame: 191]

No.     Time            Source                Destination           Protocol Length Info
    172 17:49:12.329382 54.239.22.213         10.207.175.99         HTTP     326    HTTP/1.1 200 OK  (GIF89a)

Frame 172: 326 bytes on wire (2608 bits), 326 bytes captured (2608 bits)
Linux cooked capture
Internet Protocol Version 4, Src: 54.239.22.213 (54.239.22.213), Dst: 10.207.175.99 (10.207.175.99)
Transmission Control Protocol, Src Port: 80 (80), Dst Port: 33477 (33477), Seq: 1, Ack: 1133, Len: 258
Hypertext Transfer Protocol
    HTTP/1.1 200 OK\r\n
    Date: Wed, 14 Oct 2015 15:50:01 GMT\r\n
    Server: Server\r\n
    x-amzn-RequestId: 3b444aff-728b-11e5-a24b-f786282940ab\r\n
    Content-Type: image/gif\r\n
    Content-Length: 43\r\n
    Vary: User-Agent\r\n
    Connection: keep-alive\r\n
    \r\n
    [HTTP response 1/3]
    [Time since request: 0.170422000 seconds]
    [Request in frame: 141]
    [Next request in frame: 511]
    [Next response in frame: 534]
Compuserve GIF, Version: GIF89a

No.     Time            Source                Destination           Protocol Length Info
    174 17:49:12.334529 54.240.162.96         10.207.175.99         HTTP     443    HTTP/1.1 200 OK  (PNG)

Frame 174: 443 bytes on wire (3544 bits), 443 bytes captured (3544 bits)
Linux cooked capture
Internet Protocol Version 4, Src: 54.240.162.96 (54.240.162.96), Dst: 10.207.175.99 (10.207.175.99)
Transmission Control Protocol, Src Port: 80 (80), Dst Port: 54726 (54726), Seq: 15929, Ack: 477, Len: 375
[12 Reassembled TCP Segments (16303 bytes): #150(1448), #152(1448), #154(1448), #156(1448), #158(1448), #160(1448), #162(1448), #164(1448), #166(1448), #168(1448), #170(1448), #174(375)]
Hypertext Transfer Protocol
    HTTP/1.1 200 OK\r\n
    Content-Type: image/png\r\n
    Content-Length: 15847\r\n
    Server: nginx\r\n
    Date: Tue, 11 Aug 2015 11:09:07 GMT\r\n
    Last-Modified: Thu, 01 Jan 2015 00:18:25 GMT\r\n
    Cache-Control: max-age=630720000,public\r\n
    Expires: Wed, 18 May 2033 03:33:20 GMT\r\n
    Age: 5627449\r\n
    X-Cache: Hit from cloudfront\r\n
    Via: 1.1 16a8156bb9e085b1e79a6bf5cb89d49e.cloudfront.net (CloudFront)\r\n
    X-Amz-Cf-Id: WjlGVifL81Zc0MquoOQi8MVLimGZCb-i2Vidfsx1Mu_IP8zfsqCOCg==\r\n
    Connection: keep-alive\r\n
    \r\n
    [HTTP response 1/2]
    [Time since request: 0.063029000 seconds]
    [Request in frame: 147]
    [Next request in frame: 423]
    [Next response in frame: 454]
Portable Network Graphics

No.     Time            Source                Destination           Protocol Length Info
    186 17:49:12.338114 54.240.162.96         10.207.175.99         HTTP     424    HTTP/1.1 200 OK  (JPEG JFIF image)

Frame 186: 424 bytes on wire (3392 bits), 424 bytes captured (3392 bits)
Linux cooked capture
Internet Protocol Version 4, Src: 54.240.162.96 (54.240.162.96), Dst: 10.207.175.99 (10.207.175.99)
Transmission Control Protocol, Src Port: 80 (80), Dst Port: 54732 (54732), Seq: 7241, Ack: 516, Len: 356
[6 Reassembled TCP Segments (7596 bytes): #176(1448), #178(1448), #180(1448), #182(1448), #184(1448), #186(356)]
Hypertext Transfer Protocol
    HTTP/1.1 200 OK\r\n
    Content-Type: image/jpeg\r\n
    Content-Length: 7109\r\n
    Server: nginx\r\n
    Date: Sat, 10 Oct 2015 18:11:14 GMT\r\n
    Cache-Control: max-age=630720000,public\r\n
    Expires: Wed, 18 May 2033 03:33:20 GMT\r\n
    Last-Modified: Thu, 27 Aug 2015 00:29:03 GMT\r\n
    Access-Control-Allow-Origin: *\r\n
    Age: 429208\r\n
    X-Cache: Hit from cloudfront\r\n
    Via: 1.1 6fd049110ebc3ac6deddab8b0bf5d686.cloudfront.net (CloudFront)\r\n
    X-Amz-Cf-Id: MbGtF8tz9DRcvnzCEbgxQC_dPvNJqUf9pqtWIgejVnnABpK6rwp9JQ==\r\n
    Connection: keep-alive\r\n
    \r\n
    [HTTP response 1/6]
    [Time since request: 0.064235000 seconds]
    [Request in frame: 148]
    [Next request in frame: 191]
    [Next response in frame: 206]
JPEG File Interchange Format
    Marker: Start of Image (0xffd8)
    Marker segment: Reserved for application segments - 0 (0xFFE0)
    Marker segment: Define quantization table(s) (0xFFDB)
    Marker segment: Define quantization table(s) (0xFFDB)
    Start of Frame header: Start of Frame (non-differential, Huffman coding) - Baseline DCT (0xFFC0)
    Marker segment: Define Huffman table(s) (0xFFC4)
    Marker segment: Define Huffman table(s) (0xFFC4)
    Marker segment: Define Huffman table(s) (0xFFC4)
    Marker segment: Define Huffman table(s) (0xFFC4)
    Start of Segment header: Start of Scan (0xFFDA)
    Entropy-coded segment (dissection is not yet implemented)
    Marker: End of Image (0xffd9)

No.     Time            Source                Destination           Protocol Length Info
    188 17:49:12.379260 10.207.175.99         88.221.117.200        HTTP     593    GET /images/G/01/AUIClients/GenericObservableJS-01e038760277ea2c820d295a81fb0bf7973a9d36.min._V2_.js HTTP/1.1 

Frame 188: 593 bytes on wire (4744 bits), 593 bytes captured (4744 bits)
Linux cooked capture
Internet Protocol Version 4, Src: 10.207.175.99 (10.207.175.99), Dst: 88.221.117.200 (88.221.117.200)
Transmission Control Protocol, Src Port: 47494 (47494), Dst Port: 80 (80), Seq: 1, Ack: 1, Len: 525
Hypertext Transfer Protocol
    GET /images/G/01/AUIClients/GenericObservableJS-01e038760277ea2c820d295a81fb0bf7973a9d36.min._V2_.js HTTP/1.1\r\n
    Host: z-ecx.images-amazon.com\r\n
    Connection: keep-alive\r\n
    Accept: */*\r\n
    Origin: http://www.amazon.com\r\n
    User-Agent: Mozilla/5.0 (Linux; Android 4.4.2; SM-G900F Build/KOT49H) AppleWebKit/537.36 (KHTML, like Gecko) Version/4.0 Chrome/30.0.0.0 Mobile Safari/537.36\r\n
    Referer: http://www.amazon.com/\r\n
    Accept-Encoding: gzip,deflate\r\n
    Accept-Language: de-DE,en-US;q=0.8\r\n
    X-Requested-With: com.swissqual.qualipoc.gui.control\r\n
    \r\n
    [Full request URI: http://z-ecx.images-amazon.com/images/G/01/AUIClients/GenericObservableJS-01e038760277ea2c820d295a81fb0bf7973a9d36.min._V2_.js]
    [HTTP request 1/2]
    [Response in frame: 189]
    [Next request in frame: 212]

No.     Time            Source                Destination           Protocol Length Info
    189 17:49:12.425010 88.221.117.200        10.207.175.99         HTTP     793    HTTP/1.1 200 OK  (application/x-javascript)

Frame 189: 793 bytes on wire (6344 bits), 793 bytes captured (6344 bits)
Linux cooked capture
Internet Protocol Version 4, Src: 88.221.117.200 (88.221.117.200), Dst: 10.207.175.99 (10.207.175.99)
Transmission Control Protocol, Src Port: 80 (80), Dst Port: 47494 (47494), Seq: 1, Ack: 526, Len: 725
Hypertext Transfer Protocol
    HTTP/1.1 200 OK\r\n
    Server: nginx\r\n
    Content-Type: application/x-javascript\r\n
    Last-Modified: Mon, 24 Nov 2014 06:10:30 GMT\r\n
    Access-Control-Allow-Origin: *\r\n
    Vary: Accept-Encoding\r\n
    Content-Encoding: gzip\r\n
    Cache-Control: public, max-age=619772205\r\n
    Expires: Mon, 04 Jun 2035 22:46:47 GMT\r\n
    Date: Wed, 14 Oct 2015 15:50:02 GMT\r\n
    Content-Length: 362\r\n
    Connection: keep-alive\r\n
    \r\n
    [HTTP response 1/2]
    [Time since request: 0.045750000 seconds]
    [Request in frame: 188]
    [Next request in frame: 212]
    [Next response in frame: 393]
    Content-encoded entity body (gzip): 362 bytes -> 603 bytes
Line-based text data: application/x-javascript

No.     Time            Source                Destination           Protocol Length Info
    191 17:49:12.450608 10.207.175.99         54.240.162.96         HTTP     537    GET /images/G/01/amazonui/loading/loading-4x-gray._V1_.gif HTTP/1.1 

Frame 191: 537 bytes on wire (4296 bits), 537 bytes captured (4296 bits)
Linux cooked capture
Internet Protocol Version 4, Src: 10.207.175.99 (10.207.175.99), Dst: 54.240.162.96 (54.240.162.96)
Transmission Control Protocol, Src Port: 54732 (54732), Dst Port: 80 (80), Seq: 516, Ack: 7597, Len: 469
Hypertext Transfer Protocol
    GET /images/G/01/amazonui/loading/loading-4x-gray._V1_.gif HTTP/1.1\r\n
    Host: g-ecx.images-amazon.com\r\n
    Connection: keep-alive\r\n
    Accept: image/webp,*/*;q=0.8\r\n
    User-Agent: Mozilla/5.0 (Linux; Android 4.4.2; SM-G900F Build/KOT49H) AppleWebKit/537.36 (KHTML, like Gecko) Version/4.0 Chrome/30.0.0.0 Mobile Safari/537.36\r\n
    Referer: http://www.amazon.com/\r\n
    Accept-Encoding: gzip,deflate\r\n
    Accept-Language: de-DE,en-US;q=0.8\r\n
    X-Requested-With: com.swissqual.qualipoc.gui.control\r\n
    \r\n
    [Full request URI: http://g-ecx.images-amazon.com/images/G/01/amazonui/loading/loading-4x-gray._V1_.gif]
    [HTTP request 2/6]
    [Prev request in frame: 148]
    [Response in frame: 206]
    [Next request in frame: 209]

No.     Time            Source                Destination           Protocol Length Info
    206 17:49:12.505869 54.240.162.96         10.207.175.99         HTTP     135    HTTP/1.1 200 OK  (GIF89a)

Frame 206: 135 bytes on wire (1080 bits), 135 bytes captured (1080 bits)
Linux cooked capture
Internet Protocol Version 4, Src: 54.240.162.96 (54.240.162.96), Dst: 10.207.175.99 (10.207.175.99)
Transmission Control Protocol, Src Port: 80 (80), Dst Port: 54732 (54732), Seq: 17733, Ack: 985, Len: 67
[8 Reassembled TCP Segments (10203 bytes): #192(1448), #194(1448), #196(1448), #198(1448), #200(1448), #202(1448), #204(1448), #206(67)]
Hypertext Transfer Protocol
    HTTP/1.1 200 OK\r\n
    Content-Type: image/gif\r\n
    Content-Length: 9748\r\n
    Server: nginx\r\n
    Date: Tue, 11 Aug 2015 11:07:06 GMT\r\n
    Cache-Control: max-age=630720000,public\r\n
    Expires: Wed, 18 May 2033 03:33:20 GMT\r\n
    Last-Modified: Thu, 05 Feb 2015 21:20:13 GMT\r\n
    Age: 5559874\r\n
    X-Cache: Hit from cloudfront\r\n
    Via: 1.1 6fd049110ebc3ac6deddab8b0bf5d686.cloudfront.net (CloudFront)\r\n
    X-Amz-Cf-Id: MtHhBABS2y-buNCIzQs8bKCqSgCW34BjKYCvUbAnu_FG8kH-RLQ0ug==\r\n
    Connection: keep-alive\r\n
    \r\n
    [HTTP response 2/6]
    [Time since request: 0.055261000 seconds]
    [Prev request in frame: 148]
    [Prev response in frame: 186]
    [Request in frame: 191]
    [Next request in frame: 209]
    [Next response in frame: 336]
Compuserve GIF, Version: GIF89a

No.     Time            Source                Destination           Protocol Length Info
    208 17:49:12.507590 10.207.175.99         54.192.47.84          HTTP     518    GET /images/I/41%2Bjw%2Bk87yL._SY150_.jpg HTTP/1.1 

Frame 208: 518 bytes on wire (4144 bits), 518 bytes captured (4144 bits)
Linux cooked capture
Internet Protocol Version 4, Src: 10.207.175.99 (10.207.175.99), Dst: 54.192.47.84 (54.192.47.84)
Transmission Control Protocol, Src Port: 51762 (51762), Dst Port: 80 (80), Seq: 1, Ack: 1, Len: 450
Hypertext Transfer Protocol
    GET /images/I/41%2Bjw%2Bk87yL._SY150_.jpg HTTP/1.1\r\n
    Host: ecx.images-amazon.com\r\n
    Connection: keep-alive\r\n
    Accept: image/webp,*/*;q=0.8\r\n
    User-Agent: Mozilla/5.0 (Linux; Android 4.4.2; SM-G900F Build/KOT49H) AppleWebKit/537.36 (KHTML, like Gecko) Version/4.0 Chrome/30.0.0.0 Mobile Safari/537.36\r\n
    Referer: http://www.amazon.com/\r\n
    Accept-Encoding: gzip,deflate\r\n
    Accept-Language: de-DE,en-US;q=0.8\r\n
    X-Requested-With: com.swissqual.qualipoc.gui.control\r\n
    \r\n
    [Full request URI: http://ecx.images-amazon.com/images/I/41%2Bjw%2Bk87yL._SY150_.jpg]
    [HTTP request 1/4]
    [Response in frame: 230]
    [Next request in frame: 257]

No.     Time            Source                Destination           Protocol Length Info
    209 17:49:12.512969 10.207.175.99         54.240.162.96         HTTP     582    GET /images/G/01/AUIClients/AmazonUIBaseCSS-sprite_2x-47934801beec8b5c0b18b3545b4a03a679294900._V2_.png HTTP/1.1 

Frame 209: 582 bytes on wire (4656 bits), 582 bytes captured (4656 bits)
Linux cooked capture
Internet Protocol Version 4, Src: 10.207.175.99 (10.207.175.99), Dst: 54.240.162.96 (54.240.162.96)
Transmission Control Protocol, Src Port: 54732 (54732), Dst Port: 80 (80), Seq: 985, Ack: 17800, Len: 514
Hypertext Transfer Protocol
    GET /images/G/01/AUIClients/AmazonUIBaseCSS-sprite_2x-47934801beec8b5c0b18b3545b4a03a679294900._V2_.png HTTP/1.1\r\n
    Host: g-ecx.images-amazon.com\r\n
    Connection: keep-alive\r\n
    Accept: image/webp,*/*;q=0.8\r\n
    User-Agent: Mozilla/5.0 (Linux; Android 4.4.2; SM-G900F Build/KOT49H) AppleWebKit/537.36 (KHTML, like Gecko) Version/4.0 Chrome/30.0.0.0 Mobile Safari/537.36\r\n
    Referer: http://www.amazon.com/\r\n
    Accept-Encoding: gzip,deflate\r\n
    Accept-Language: de-DE,en-US;q=0.8\r\n
    X-Requested-With: com.swissqual.qualipoc.gui.control\r\n
    \r\n
    [Full request URI: http://g-ecx.images-amazon.com/images/G/01/AUIClients/AmazonUIBaseCSS-sprite_2x-47934801beec8b5c0b18b3545b4a03a679294900._V2_.png]
    [HTTP request 3/6]
    [Prev request in frame: 191]
    [Response in frame: 336]
    [Next request in frame: 422]

No.     Time            Source                Destination           Protocol Length Info
    210 17:49:12.518445 10.207.175.99         54.192.47.84          HTTP     514    GET /images/I/41ElUzWNYfL._SY150_.jpg HTTP/1.1 

Frame 210: 514 bytes on wire (4112 bits), 514 bytes captured (4112 bits)
Linux cooked capture
Internet Protocol Version 4, Src: 10.207.175.99 (10.207.175.99), Dst: 54.192.47.84 (54.192.47.84)
Transmission Control Protocol, Src Port: 51764 (51764), Dst Port: 80 (80), Seq: 1, Ack: 1, Len: 446
Hypertext Transfer Protocol
    GET /images/I/41ElUzWNYfL._SY150_.jpg HTTP/1.1\r\n
    Host: ecx.images-amazon.com\r\n
    Connection: keep-alive\r\n
    Accept: image/webp,*/*;q=0.8\r\n
    User-Agent: Mozilla/5.0 (Linux; Android 4.4.2; SM-G900F Build/KOT49H) AppleWebKit/537.36 (KHTML, like Gecko) Version/4.0 Chrome/30.0.0.0 Mobile Safari/537.36\r\n
    Referer: http://www.amazon.com/\r\n
    Accept-Encoding: gzip,deflate\r\n
    Accept-Language: de-DE,en-US;q=0.8\r\n
    X-Requested-With: com.swissqual.qualipoc.gui.control\r\n
    \r\n
    [Full request URI: http://ecx.images-amazon.com/images/I/41ElUzWNYfL._SY150_.jpg]
    [HTTP request 1/5]
    [Response in frame: 234]
    [Next request in frame: 241]

No.     Time            Source                Destination           Protocol Length Info
    211 17:49:12.524499 10.207.175.99         54.240.162.236        HTTP     516    GET /images/I/41UPG%2BL94nL._SY150_.jpg HTTP/1.1 

Frame 211: 516 bytes on wire (4128 bits), 516 bytes captured (4128 bits)
Linux cooked capture
Internet Protocol Version 4, Src: 10.207.175.99 (10.207.175.99), Dst: 54.240.162.236 (54.240.162.236)
Transmission Control Protocol, Src Port: 40876 (40876), Dst Port: 80 (80), Seq: 1, Ack: 1, Len: 448
Hypertext Transfer Protocol
    GET /images/I/41UPG%2BL94nL._SY150_.jpg HTTP/1.1\r\n
    Host: ecx.images-amazon.com\r\n
    Connection: keep-alive\r\n
    Accept: image/webp,*/*;q=0.8\r\n
    User-Agent: Mozilla/5.0 (Linux; Android 4.4.2; SM-G900F Build/KOT49H) AppleWebKit/537.36 (KHTML, like Gecko) Version/4.0 Chrome/30.0.0.0 Mobile Safari/537.36\r\n
    Referer: http://www.amazon.com/\r\n
    Accept-Encoding: gzip,deflate\r\n
    Accept-Language: de-DE,en-US;q=0.8\r\n
    X-Requested-With: com.swissqual.qualipoc.gui.control\r\n
    \r\n
    [Full request URI: http://ecx.images-amazon.com/images/I/41UPG%2BL94nL._SY150_.jpg]
    [HTTP request 1/3]
    [Response in frame: 239]
    [Next request in frame: 253]

No.     Time            Source                Destination           Protocol Length Info
    212 17:49:12.556355 10.207.175.99         88.221.117.200        HTTP     578    GET /images/G/01/AUIClients/AmazonUI-59993146b9b928d93c5e7c480600481402313089._V2_.js HTTP/1.1 

Frame 212: 578 bytes on wire (4624 bits), 578 bytes captured (4624 bits)
Linux cooked capture
Internet Protocol Version 4, Src: 10.207.175.99 (10.207.175.99), Dst: 88.221.117.200 (88.221.117.200)
Transmission Control Protocol, Src Port: 47494 (47494), Dst Port: 80 (80), Seq: 526, Ack: 726, Len: 510
Hypertext Transfer Protocol
    GET /images/G/01/AUIClients/AmazonUI-59993146b9b928d93c5e7c480600481402313089._V2_.js HTTP/1.1\r\n
    Host: z-ecx.images-amazon.com\r\n
    Connection: keep-alive\r\n
    Accept: */*\r\n
    Origin: http://www.amazon.com\r\n
    User-Agent: Mozilla/5.0 (Linux; Android 4.4.2; SM-G900F Build/KOT49H) AppleWebKit/537.36 (KHTML, like Gecko) Version/4.0 Chrome/30.0.0.0 Mobile Safari/537.36\r\n
    Referer: http://www.amazon.com/\r\n
    Accept-Encoding: gzip,deflate\r\n
    Accept-Language: de-DE,en-US;q=0.8\r\n
    X-Requested-With: com.swissqual.qualipoc.gui.control\r\n
    \r\n
    [Full request URI: http://z-ecx.images-amazon.com/images/G/01/AUIClients/AmazonUI-59993146b9b928d93c5e7c480600481402313089._V2_.js]
    [HTTP request 2/2]
    [Prev request in frame: 188]
    [Response in frame: 393]

No.     Time            Source                Destination           Protocol Length Info
    213 17:49:12.558970 10.207.175.99         88.221.117.200        HTTP     593    GET /images/G/01/AUIClients/NavAuiMobileAssetsSmart-8bda3bf4afee7406d75c3c0446d7f228c9ff0c8c._V2_.js HTTP/1.1 

Frame 213: 593 bytes on wire (4744 bits), 593 bytes captured (4744 bits)
Linux cooked capture
Internet Protocol Version 4, Src: 10.207.175.99 (10.207.175.99), Dst: 88.221.117.200 (88.221.117.200)
Transmission Control Protocol, Src Port: 47493 (47493), Dst Port: 80 (80), Seq: 1, Ack: 1, Len: 525
Hypertext Transfer Protocol
    GET /images/G/01/AUIClients/NavAuiMobileAssetsSmart-8bda3bf4afee7406d75c3c0446d7f228c9ff0c8c._V2_.js HTTP/1.1\r\n
    Host: z-ecx.images-amazon.com\r\n
    Connection: keep-alive\r\n
    Accept: */*\r\n
    Origin: http://www.amazon.com\r\n
    User-Agent: Mozilla/5.0 (Linux; Android 4.4.2; SM-G900F Build/KOT49H) AppleWebKit/537.36 (KHTML, like Gecko) Version/4.0 Chrome/30.0.0.0 Mobile Safari/537.36\r\n
    Referer: http://www.amazon.com/\r\n
    Accept-Encoding: gzip,deflate\r\n
    Accept-Language: de-DE,en-US;q=0.8\r\n
    X-Requested-With: com.swissqual.qualipoc.gui.control\r\n
    \r\n
    [Full request URI: http://z-ecx.images-amazon.com/images/G/01/AUIClients/NavAuiMobileAssetsSmart-8bda3bf4afee7406d75c3c0446d7f228c9ff0c8c._V2_.js]
    [HTTP request 1/1]
    [Response in frame: 322]

No.     Time            Source                Destination           Protocol Length Info
    230 17:49:12.572793 54.192.47.84          10.207.175.99         HTTP     535    HTTP/1.1 200 OK  (JPEG JFIF image)

Frame 230: 535 bytes on wire (4280 bits), 535 bytes captured (4280 bits)
Linux cooked capture
Internet Protocol Version 4, Src: 54.192.47.84 (54.192.47.84), Dst: 10.207.175.99 (10.207.175.99)
Transmission Control Protocol, Src Port: 80 (80), Dst Port: 51762 (51762), Seq: 2897, Ack: 451, Len: 467
[3 Reassembled TCP Segments (3363 bytes): #227(1448), #228(1448), #230(467)]
Hypertext Transfer Protocol
    HTTP/1.1 200 OK\r\n
    Content-Type: image/jpeg\r\n
    Content-Length: 2845\r\n
    Server: nginx\r\n
    Date: Mon, 21 Sep 2015 10:36:12 GMT\r\n
    Cache-Control: max-age=630720000,public\r\n
    Expires: Wed, 18 May 2033 03:33:20 GMT\r\n
    ETag: "41+jw+k87yL_SY150_#1"\r\n
    Last-Modified: Mon, 22 Jun 2015 19:19:17 GMT\r\n
    Access-Control-Allow-Origin: *\r\n
    Age: 2036129\r\n
    X-Cache: Hit from cloudfront\r\n
    Via: 1.1 b4ee4db849dcb5fce83f0bc3d6a9d57f.cloudfront.net (CloudFront)\r\n
    X-Amz-Cf-Id: Mp-2g_Ek66qS8ZPXAF7b_Ht62aVVA9HDNb5ECN9Jwck-TmmeRIXW5w==\r\n
    Connection: keep-alive\r\n
    \r\n
    [HTTP response 1/4]
    [Time since request: 0.065203000 seconds]
    [Request in frame: 208]
    [Next request in frame: 257]
    [Next response in frame: 416]
JPEG File Interchange Format
    Marker: Start of Image (0xffd8)
    Marker segment: Reserved for application segments - 0 (0xFFE0)
    Marker segment: Define quantization table(s) (0xFFDB)
    Marker segment: Define quantization table(s) (0xFFDB)
    Start of Frame header: Start of Frame (non-differential, Huffman coding) - Baseline DCT (0xFFC0)
    Marker segment: Define Huffman table(s) (0xFFC4)
    Marker segment: Define Huffman table(s) (0xFFC4)
    Marker segment: Define Huffman table(s) (0xFFC4)
    Marker segment: Define Huffman table(s) (0xFFC4)
    Start of Segment header: Start of Scan (0xFFDA)
    Entropy-coded segment (dissection is not yet implemented)
    Marker: End of Image (0xffd9)

No.     Time            Source                Destination           Protocol Length Info
    234 17:49:12.574023 54.192.47.84          10.207.175.99         HTTP     719    HTTP/1.1 200 OK  (JPEG JFIF image)

Frame 234: 719 bytes on wire (5752 bits), 719 bytes captured (5752 bits)
Linux cooked capture
Internet Protocol Version 4, Src: 54.192.47.84 (54.192.47.84), Dst: 10.207.175.99 (10.207.175.99)
Transmission Control Protocol, Src Port: 80 (80), Dst Port: 51764 (51764), Seq: 2897, Ack: 447, Len: 651
[3 Reassembled TCP Segments (3547 bytes): #231(1448), #232(1448), #234(651)]
Hypertext Transfer Protocol
    HTTP/1.1 200 OK\r\n
    Content-Type: image/jpeg\r\n
    Content-Length: 3059\r\n
    Server: nginx\r\n
    Date: Sat, 19 Sep 2015 22:33:37 GMT\r\n
    Cache-Control: max-age=630720000,public\r\n
    Expires: Wed, 18 May 2033 03:33:20 GMT\r\n
    Last-Modified: Mon, 14 Sep 2015 13:26:28 GMT\r\n
    Access-Control-Allow-Origin: *\r\n
    Age: 2222326\r\n
    X-Cache: Hit from cloudfront\r\n
    Via: 1.1 02559733574bc91699d28e7c3b1df3ea.cloudfront.net (CloudFront)\r\n
    X-Amz-Cf-Id: eOCnt9zWhY7SXgvTfplqGe72q_-084PbdAzPg1V2fmEP4rC707ObIQ==\r\n
    Connection: keep-alive\r\n
    \r\n
    [HTTP response 1/5]
    [Time since request: 0.055578000 seconds]
    [Request in frame: 210]
    [Next request in frame: 241]
    [Next response in frame: 402]
JPEG File Interchange Format
    Marker: Start of Image (0xffd8)
    Marker segment: Reserved for application segments - 0 (0xFFE0)
    Marker segment: Define quantization table(s) (0xFFDB)
    Marker segment: Define quantization table(s) (0xFFDB)
    Start of Frame header: Start of Frame (non-differential, Huffman coding) - Baseline DCT (0xFFC0)
    Marker segment: Define Huffman table(s) (0xFFC4)
    Marker segment: Define Huffman table(s) (0xFFC4)
    Marker segment: Define Huffman table(s) (0xFFC4)
    Marker segment: Define Huffman table(s) (0xFFC4)
    Start of Segment header: Start of Scan (0xFFDA)
    Entropy-coded segment (dissection is not yet implemented)
    Marker: End of Image (0xffd9)

No.     Time            Source                Destination           Protocol Length Info
    239 17:49:12.581542 54.240.162.236        10.207.175.99         HTTP     810    HTTP/1.1 200 OK  (JPEG JFIF image)

Frame 239: 810 bytes on wire (6480 bits), 810 bytes captured (6480 bits)
Linux cooked capture
Internet Protocol Version 4, Src: 54.240.162.236 (54.240.162.236), Dst: 10.207.175.99 (10.207.175.99)
Transmission Control Protocol, Src Port: 80 (80), Dst Port: 40876 (40876), Seq: 2897, Ack: 449, Len: 742
[3 Reassembled TCP Segments (3638 bytes): #235(1448), #237(1448), #239(742)]
Hypertext Transfer Protocol
    HTTP/1.1 200 OK\r\n
    Content-Type: image/jpeg\r\n
    Content-Length: 3150\r\n
    Server: nginx\r\n
    Date: Sun, 20 Sep 2015 13:57:28 GMT\r\n
    Cache-Control: max-age=630720000,public\r\n
    Expires: Wed, 18 May 2033 03:33:20 GMT\r\n
    Last-Modified: Thu, 17 Sep 2015 03:34:06 GMT\r\n
    Access-Control-Allow-Origin: *\r\n
    Age: 2095873\r\n
    X-Cache: Hit from cloudfront\r\n
    Via: 1.1 002c7dd628aeaafbb16627d6bb5046c9.cloudfront.net (CloudFront)\r\n
    X-Amz-Cf-Id: Bf947i5NlRsoQJ_f9y-m8dXu5neb0UITqr5FivXq5GhorX47_iupAw==\r\n
    Connection: keep-alive\r\n
    \r\n
    [HTTP response 1/3]
    [Time since request: 0.057043000 seconds]
    [Request in frame: 211]
    [Next request in frame: 253]
    [Next response in frame: 410]
JPEG File Interchange Format
    Marker: Start of Image (0xffd8)
    Marker segment: Reserved for application segments - 0 (0xFFE0)
    Marker segment: Define quantization table(s) (0xFFDB)
    Marker segment: Define quantization table(s) (0xFFDB)
    Start of Frame header: Start of Frame (non-differential, Huffman coding) - Baseline DCT (0xFFC0)
    Marker segment: Define Huffman table(s) (0xFFC4)
    Marker segment: Define Huffman table(s) (0xFFC4)
    Marker segment: Define Huffman table(s) (0xFFC4)
    Marker segment: Define Huffman table(s) (0xFFC4)
    Start of Segment header: Start of Scan (0xFFDA)
    Entropy-coded segment (dissection is not yet implemented)
    Marker: End of Image (0xffd9)

No.     Time            Source                Destination           Protocol Length Info
    241 17:49:12.582204 10.207.175.99         54.192.47.84          HTTP     514    GET /images/I/51WpYDAvX0L._SY150_.jpg HTTP/1.1 

Frame 241: 514 bytes on wire (4112 bits), 514 bytes captured (4112 bits)
Linux cooked capture
Internet Protocol Version 4, Src: 10.207.175.99 (10.207.175.99), Dst: 54.192.47.84 (54.192.47.84)
Transmission Control Protocol, Src Port: 51764 (51764), Dst Port: 80 (80), Seq: 447, Ack: 3548, Len: 446
Hypertext Transfer Protocol
    GET /images/I/51WpYDAvX0L._SY150_.jpg HTTP/1.1\r\n
    Host: ecx.images-amazon.com\r\n
    Connection: keep-alive\r\n
    Accept: image/webp,*/*;q=0.8\r\n
    User-Agent: Mozilla/5.0 (Linux; Android 4.4.2; SM-G900F Build/KOT49H) AppleWebKit/537.36 (KHTML, like Gecko) Version/4.0 Chrome/30.0.0.0 Mobile Safari/537.36\r\n
    Referer: http://www.amazon.com/\r\n
    Accept-Encoding: gzip,deflate\r\n
    Accept-Language: de-DE,en-US;q=0.8\r\n
    X-Requested-With: com.swissqual.qualipoc.gui.control\r\n
    \r\n
    [Full request URI: http://ecx.images-amazon.com/images/I/51WpYDAvX0L._SY150_.jpg]
    [HTTP request 2/5]
    [Prev request in frame: 210]
    [Response in frame: 402]
    [Next request in frame: 411]

No.     Time            Source                Destination           Protocol Length Info
    253 17:49:12.591191 10.207.175.99         54.240.162.236        HTTP     514    GET /images/I/51PSMWUpEPL._SY150_.jpg HTTP/1.1 

Frame 253: 514 bytes on wire (4112 bits), 514 bytes captured (4112 bits)
Linux cooked capture
Internet Protocol Version 4, Src: 10.207.175.99 (10.207.175.99), Dst: 54.240.162.236 (54.240.162.236)
Transmission Control Protocol, Src Port: 40876 (40876), Dst Port: 80 (80), Seq: 449, Ack: 3639, Len: 446
Hypertext Transfer Protocol
    GET /images/I/51PSMWUpEPL._SY150_.jpg HTTP/1.1\r\n
    Host: ecx.images-amazon.com\r\n
    Connection: keep-alive\r\n
    Accept: image/webp,*/*;q=0.8\r\n
    User-Agent: Mozilla/5.0 (Linux; Android 4.4.2; SM-G900F Build/KOT49H) AppleWebKit/537.36 (KHTML, like Gecko) Version/4.0 Chrome/30.0.0.0 Mobile Safari/537.36\r\n
    Referer: http://www.amazon.com/\r\n
    Accept-Encoding: gzip,deflate\r\n
    Accept-Language: de-DE,en-US;q=0.8\r\n
    X-Requested-With: com.swissqual.qualipoc.gui.control\r\n
    \r\n
    [Full request URI: http://ecx.images-amazon.com/images/I/51PSMWUpEPL._SY150_.jpg]
    [HTTP request 2/3]
    [Prev request in frame: 211]
    [Response in frame: 410]
    [Next request in frame: 717]

No.     Time            Source                Destination           Protocol Length Info
    257 17:49:12.595668 10.207.175.99         54.192.47.84          HTTP     516    GET /images/I/516N%2BfTbMtL._SY150_.jpg HTTP/1.1 

Frame 257: 516 bytes on wire (4128 bits), 516 bytes captured (4128 bits)
Linux cooked capture
Internet Protocol Version 4, Src: 10.207.175.99 (10.207.175.99), Dst: 54.192.47.84 (54.192.47.84)
Transmission Control Protocol, Src Port: 51762 (51762), Dst Port: 80 (80), Seq: 451, Ack: 3364, Len: 448
Hypertext Transfer Protocol
    GET /images/I/516N%2BfTbMtL._SY150_.jpg HTTP/1.1\r\n
    Host: ecx.images-amazon.com\r\n
    Connection: keep-alive\r\n
    Accept: image/webp,*/*;q=0.8\r\n
    User-Agent: Mozilla/5.0 (Linux; Android 4.4.2; SM-G900F Build/KOT49H) AppleWebKit/537.36 (KHTML, like Gecko) Version/4.0 Chrome/30.0.0.0 Mobile Safari/537.36\r\n
    Referer: http://www.amazon.com/\r\n
    Accept-Encoding: gzip,deflate\r\n
    Accept-Language: de-DE,en-US;q=0.8\r\n
    X-Requested-With: com.swissqual.qualipoc.gui.control\r\n
    \r\n
    [Full request URI: http://ecx.images-amazon.com/images/I/516N%2BfTbMtL._SY150_.jpg]
    [HTTP request 2/4]
    [Prev request in frame: 208]
    [Response in frame: 416]
    [Next request in frame: 565]

No.     Time            Source                Destination           Protocol Length Info
    322 17:49:12.615822 88.221.117.200        10.207.175.99         HTTP     200    HTTP/1.1 200 OK  (application/x-javascript)

Frame 322: 200 bytes on wire (1600 bits), 200 bytes captured (1600 bits)
Linux cooked capture
Internet Protocol Version 4, Src: 88.221.117.200 (88.221.117.200), Dst: 10.207.175.99 (10.207.175.99)
